# name: test/sql/migration/inlined_column_rename.test
# description: migrating a v1.0 catalog renames inlined-data metadata columns to the _ducklake_ prefix
# group: [migration]

require ducklake

require parquet

statement ok
ATTACH 'ducklake:{TEST_DIR}/inlined_rename.db' AS dl (DATA_PATH '{TEST_DIR}/inlined_rename_files', DUCKLAKE_VERSION '1.0')

statement ok
CREATE TABLE dl.t(i INTEGER, j INTEGER);

statement ok
INSERT INTO dl.t VALUES (1, 2), (3, 4);

# v1.0 inlined tables use unprefixed metadata columns
query I
SELECT COUNT(*) FROM (DESCRIBE __ducklake_metadata_dl.ducklake_inlined_data_1_1) WHERE column_name = 'row_id'
----
1

statement ok
DETACH dl

# re-attaching without migration keeps the catalog readable at v1.0
statement ok
ATTACH 'ducklake:{TEST_DIR}/inlined_rename.db' AS dl (DATA_PATH '{TEST_DIR}/inlined_rename_files')

query II
SELECT * FROM dl.t ORDER BY i
----
1	2
3	4

statement ok
INSERT INTO dl.t VALUES (5, 6);

statement ok
DETACH dl

# migrating to 1.1-dev1 renames the metadata columns
statement ok
ATTACH 'ducklake:{TEST_DIR}/inlined_rename.db' AS dl (DATA_PATH '{TEST_DIR}/inlined_rename_files', AUTOMATIC_MIGRATION TRUE)

query I
SELECT COUNT(*) FROM (DESCRIBE __ducklake_metadata_dl.ducklake_inlined_data_1_1) WHERE column_name = 'row_id'
----
0

query I
SELECT COUNT(*) FROM (DESCRIBE __ducklake_metadata_dl.ducklake_inlined_data_1_1) WHERE column_name IN ('_ducklake_row_id', '_ducklake_begin_snapshot', '_ducklake_end_snapshot')
----
3

# row ids are preserved across the rename
query III
SELECT rowid, i, j FROM dl.t ORDER BY rowid
----
0	1	2
1	3	4
2	5	6

statement ok
INSERT INTO dl.t VALUES (7, 8);

statement ok
DELETE FROM dl.t WHERE i = 3;

query II
SELECT i, j FROM dl.t ORDER BY i
----
1	2
5	6
7	8

statement ok
DETACH dl

# re-running the in-place dev migration is a no-op
statement ok
ATTACH 'ducklake:{TEST_DIR}/inlined_rename.db' AS dl (DATA_PATH '{TEST_DIR}/inlined_rename_files', AUTOMATIC_MIGRATION TRUE)

query II
SELECT i, j FROM dl.t ORDER BY i
----
1	2
5	6
7	8

statement ok
DETACH dl

# a v1.0 user column that collides with the new metadata names aborts the migration cleanly
statement ok
ATTACH 'ducklake:{TEST_DIR}/inlined_conflict.db' AS dlc (DATA_PATH '{TEST_DIR}/inlined_conflict_files', DUCKLAKE_VERSION '1.0')

statement ok
CREATE TABLE dlc.c(_ducklake_row_id INTEGER);

statement ok
INSERT INTO dlc.c VALUES (1);

statement ok
DETACH dlc

statement error
ATTACH 'ducklake:{TEST_DIR}/inlined_conflict.db' AS dlc (DATA_PATH '{TEST_DIR}/inlined_conflict_files', AUTOMATIC_MIGRATION TRUE)
----
Failed to rename inlined-data metadata columns

# the catalog is still at v1.0 and fully usable
statement ok
ATTACH 'ducklake:{TEST_DIR}/inlined_conflict.db' AS dlc (DATA_PATH '{TEST_DIR}/inlined_conflict_files')

query I
SELECT * FROM dlc.c
----
1
