# name: test/sql/data_inlining/data_inlining_null_type.test
# description: inline NULL-typed columns in the metadata catalog
# group: [data_inlining]

require ducklake

require parquet

test-env DUCKLAKE_CONNECTION {TEST_DIR}/{UUID}.db

test-env DATA_PATH {TEST_DIR}

statement ok
ATTACH 'ducklake:{DUCKLAKE_CONNECTION}' AS ducklake (DATA_PATH '{DATA_PATH}/data_inlining_null_type', METADATA_CATALOG 'ducklake_meta', DATA_INLINING_ROW_LIMIT 10)

statement ok
USE ducklake

statement ok
CREATE TABLE t(id INTEGER, n "NULL", l "NULL"[], s STRUCT(x "NULL"), m MAP(VARCHAR, "NULL"))

statement ok
INSERT INTO t VALUES (1, NULL, [NULL], {'x': NULL}, MAP {'k': NULL}), (2, NULL, NULL, NULL, NULL), (3, NULL, [], {'x': NULL}, MAP {})

query I
SELECT COUNT(*) FROM ducklake_list_files('ducklake', 't')
----
0

query IIIII
SELECT id, n, l, s, m FROM t ORDER BY id
----
1	NULL	[NULL]	{'x': NULL}	{k=NULL}
2	NULL	NULL	NULL	NULL
3	NULL	[]	{'x': NULL}	{}

query III
SELECT COUNT(*), COUNT(n), COUNT(*) FILTER (WHERE n IS NULL) FROM t
----
3	0	3

statement ok
UPDATE t SET id = id + 10 WHERE id = 1

statement ok
DELETE FROM t WHERE id = 2

query II
SELECT id, n FROM t ORDER BY id
----
3	NULL
11	NULL

statement ok
SET VARIABLE snap = (SELECT MAX(snapshot_id) FROM ducklake_snapshots('ducklake'))

query II
SELECT id, n FROM t AT (VERSION => getvariable('snap') - 2) ORDER BY id
----
1	NULL
2	NULL
3	NULL

# promoting an inlined NULL column keeps the rows inlined
statement ok
ALTER TABLE t ALTER n TYPE INTEGER

statement ok
INSERT INTO t VALUES (4, 40, [NULL], {'x': NULL}, MAP {'k': NULL})

query I
SELECT COUNT(*) FROM ducklake_list_files('ducklake', 't')
----
0

query IIIII
SELECT id, n, l, s, m FROM t ORDER BY id
----
3	NULL	[]	{'x': NULL}	{}
4	40	[NULL]	{'x': NULL}	{k=NULL}
11	NULL	[NULL]	{'x': NULL}	{k=NULL}

statement ok
CALL ducklake_flush_inlined_data('ducklake')

query I
SELECT COUNT(*) > 0 FROM ducklake_list_files('ducklake', 't')
----
true

statement ok
INSERT INTO t VALUES (5, NULL, NULL, NULL, NULL)

query IIIII
SELECT id, n, l, s, m FROM t ORDER BY id
----
3	NULL	[]	{'x': NULL}	{}
4	40	[NULL]	{'x': NULL}	{k=NULL}
5	NULL	NULL	NULL	NULL
11	NULL	[NULL]	{'x': NULL}	{k=NULL}
