# name: test/sql/data_inlining/inlining_reserved_column_names.test
# description: the _ducklake_ prefix is reserved; legacy reserved names (row_id, begin_snapshot, end_snapshot) are regular columns
# group: [data_inlining]

require ducklake

require parquet

statement ok
ATTACH 'ducklake:{TEST_DIR}/ducklake_reserved_cols.db' AS ducklake (DATA_PATH '{TEST_DIR}/ducklake_reserved_cols_files')

# legacy reserved names are regular columns now, even with inlining enabled
statement ok
CREATE TABLE ducklake.t1(row_id INTEGER, begin_snapshot INTEGER, end_snapshot INTEGER);

statement ok
INSERT INTO ducklake.t1 VALUES (1, 10, 100), (2, 20, 200);

# the data is inlined - no files written
query I
SELECT COUNT(*) FROM GLOB('{TEST_DIR}/ducklake_reserved_cols_files/**')
----
0

# the metadata columns of the inlined table are prefixed
query I
SELECT COUNT(*) FROM (DESCRIBE __ducklake_metadata_ducklake.ducklake_inlined_data_1_1) WHERE column_name IN ('_ducklake_row_id', '_ducklake_begin_snapshot', '_ducklake_end_snapshot')
----
3

query III
SELECT * FROM ducklake.t1 ORDER BY row_id
----
1	10	100
2	20	200

query II
SELECT rowid, row_id FROM ducklake.t1 ORDER BY rowid
----
0	1
1	2

statement ok
UPDATE ducklake.t1 SET begin_snapshot = 11 WHERE row_id = 1;

statement ok
DELETE FROM ducklake.t1 WHERE end_snapshot = 200;

query III
SELECT * FROM ducklake.t1
----
1	11	100

statement ok
ALTER TABLE ducklake.t1 ADD COLUMN extra INTEGER;

statement ok
ALTER TABLE ducklake.t1 RENAME COLUMN extra TO row_id2;

# the _ducklake_ prefix is rejected with inlining enabled...
statement error
CREATE TABLE ducklake.t_fail(_ducklake_row_id INTEGER);
----
Column name "_ducklake_row_id" is reserved by DuckLake for internal use

statement error
ALTER TABLE ducklake.t1 ADD COLUMN _ducklake_thing INTEGER;
----
reserved by DuckLake for internal use

statement error
ALTER TABLE ducklake.t1 RENAME COLUMN row_id2 TO _DUCKLAKE_upper;
----
reserved by DuckLake for internal use

# ...and also with inlining disabled
statement ok
CALL ducklake.set_option('data_inlining_row_limit', 0);

statement error
CREATE TABLE ducklake.t_fail(_ducklake_row_id INTEGER);
----
reserved by DuckLake for internal use

statement error
ALTER TABLE ducklake.t1 ADD COLUMN _ducklake_thing INTEGER;
----
reserved by DuckLake for internal use

# enabling inlining on a table with legacy reserved names is allowed now
statement ok
CALL ducklake.set_option('data_inlining_row_limit', 10, table_name => 't1');

statement ok
INSERT INTO ducklake.t1 VALUES (5, 50, 500, 5000);

query IIII
SELECT * FROM ducklake.t1 ORDER BY row_id
----
1	11	100	NULL
5	50	500	5000

statement ok
DETACH ducklake

# catalogs pinned to v1.0 keep the legacy reserved names
statement ok
ATTACH 'ducklake:{TEST_DIR}/ducklake_reserved_v10.db' AS dl10 (DATA_PATH '{TEST_DIR}/ducklake_reserved_v10_files', DUCKLAKE_VERSION '1.0')

statement error
CREATE TABLE dl10.t1(row_id INTEGER, v INTEGER);
----
Column name "row_id" is reserved by DuckLake for internal use when data inlining is enabled. If you must use this column name, disable inlining by calling ducklake_set_option('data_inlining_row_limit', 0).

# a non-internal _ducklake_ name is not reserved on v1.0
statement ok
CREATE TABLE dl10.t3(_ducklake_free INTEGER);

statement ok
INSERT INTO dl10.t3 VALUES (42);

# v1.0 inlined tables keep unprefixed metadata columns
query I
SELECT COUNT(*) FROM (DESCRIBE __ducklake_metadata_dl10.ducklake_inlined_data_1_1) WHERE column_name = 'row_id'
----
1

statement ok
CREATE TABLE dl10.t2(i INTEGER, j INTEGER);

statement error
ALTER TABLE dl10.t2 ADD COLUMN begin_snapshot INTEGER;
----
reserved

statement error
ALTER TABLE dl10.t2 RENAME COLUMN i TO end_snapshot;
----
reserved

# disabling inlining frees the legacy names on v1.0
statement ok
CALL dl10.set_option('data_inlining_row_limit', 0);

statement ok
CREATE TABLE dl10.t1(row_id INTEGER, v INTEGER);

# re-enabling inlining on a v1.0 table with legacy names is rejected
statement error
CALL dl10.set_option('data_inlining_row_limit', 10, table_name => 't1');
----
Cannot enable data inlining for table "t1". Column "row_id" conflicts with a reserved DuckLake internal column name used for inlining. To enable inlining for this table, rename or drop column "row_id".

statement ok
DETACH dl10
