# name: test/sql/partitioning/update_partition_epoch.test
# description: Test UPDATE on table partitioned by a mix of identity and epoch transforms
# group: [partitioning]

require ducklake

require parquet

test-env DUCKLAKE_CONNECTION {TEST_DIR}/{UUID}.db

test-env DATA_PATH {TEST_DIR}

statement ok
ATTACH 'ducklake:{DUCKLAKE_CONNECTION}' AS ducklake (DATA_PATH '{DATA_PATH}/ducklake_update_partition_epoch', METADATA_CATALOG 'ducklake_metadata')

statement ok
USE ducklake

statement ok
CREATE TABLE t (p VARCHAR, ts TIMESTAMP, v VARCHAR);

statement ok
ALTER TABLE t SET PARTITIONED BY (p, epoch_day(ts));

statement ok
INSERT INTO t VALUES ('p1', TIMESTAMP '2026-02-05', 'va');

statement ok
INSERT INTO t VALUES ('p2', TIMESTAMP '2026-03-10', 'vb');

statement ok
CALL ducklake_flush_inlined_data('ducklake')

statement ok
UPDATE t SET p = 'p3' WHERE v = 'va';

query III rowsort
SELECT p, ts, v FROM t;
----
p2	2026-03-10 00:00:00	vb
p3	2026-02-05 00:00:00	va

# update a non-partition column
statement ok
UPDATE t SET v = 'vc' WHERE p = 'p2';

query III rowsort
SELECT p, ts, v FROM t;
----
p2	2026-03-10 00:00:00	vc
p3	2026-02-05 00:00:00	va

# update the timestamp (used in the epoch partition transform)
statement ok
UPDATE t SET ts = TIMESTAMP '2026-06-15' WHERE p = 'p3';

query III rowsort
SELECT p, ts, v FROM t;
----
p2	2026-03-10 00:00:00	vc
p3	2026-06-15 00:00:00	va

# the rewritten row landed in the new epoch-day directory (2026-06-15 = day 20619)
statement ok
CALL ducklake_flush_inlined_data('ducklake')

query I
SELECT COUNT(*) FROM glob('{DATA_PATH}/ducklake_update_partition_epoch/main/t/**') t(path) WHERE contains(path, 'p=p3') AND contains(path, 'epoch_day=20619')
----
1
