# name: test/sql/deletion_inlining/verify_deletion_files.test
# description: test ducklake deletion inlining with all possible insertions and deletions
# group: [deletion_inlining]

require ducklake

require parquet

test-env DUCKLAKE_CONNECTION __TEST_DIR__/{UUID}.db

test-env DATA_PATH __TEST_DIR__

statement ok
ATTACH 'ducklake:${DUCKLAKE_CONNECTION}' AS ducklake (DATA_PATH '${DATA_PATH}/test_deletion_from_inlined_multiple_snapshots',DATA_INLINING_ROW_LIMIT 10,  METADATA_CATALOG 'ducklake_meta')

statement ok
use ducklake

statement ok
CREATE TABLE t AS SELECT range a FROM range(50);

# This creates a deletion file (19 rows deleted, which exceeds the inlining threshold)
statement ok
DELETE FROM T where a > 10 and a < 30

query IIII
SELECT table_id, begin_snapshot, end_snapshot, delete_count FROM ducklake_meta.ducklake_delete_file
----
1	2	NULL	19

query II
SELECT column_name, column_type FROM (DESCRIBE SELECT * FROM '${DATA_PATH}/test_deletion_from_inlined_multiple_snapshots/**/*-delete.parquet')
----
file_path	VARCHAR
pos	BIGINT

query I
SELECT pos FROM '${DATA_PATH}/test_deletion_from_inlined_multiple_snapshots/**/*-delete.parquet' ORDER BY pos
----
11
12
13
14
15
16
17
18
19
20
21
22
23
24
25
26
27
28
29

# Now let's do two inlined deletions
statement ok
DELETE FROM T where a < 5

# Verify the first inlined deletion (5 rows: 0-4)
query III
SELECT file_id, row_id, begin_snapshot FROM ducklake_meta.ducklake_inlined_delete_1 ORDER BY row_id
----
0	0	3
0	1	3
0	2	3
0	3	3
0	4	3

statement ok
DELETE FROM T where a < 8

# Verify inlined deletions after both deletes
# Should have 8 rows total: 5 from first delete (snapshot 3) + 3 from second delete (snapshot 4)
# The second delete should NOT re-insert rows 0-4 that were already deleted
query III
SELECT file_id, row_id, begin_snapshot FROM ducklake_meta.ducklake_inlined_delete_1 ORDER BY row_id
----
0	0	3
0	1	3
0	2	3
0	3	3
0	4	3
0	5	4
0	6	4
0	7	4

# Let's flush
statement ok
CALL ducklake_flush_inlined_data('ducklake')

query III
SELECT file_id, row_id, begin_snapshot FROM ducklake_meta.ducklake_inlined_delete_1 ORDER BY row_id
----

# Verify deletion files start and end snapshot
# Old delete file should have end_snapshot set (superseded)
# New consolidated delete file should have end_snapshot NULL and partial_max set
query IIIII
SELECT table_id, begin_snapshot, end_snapshot, delete_count, partial_max FROM ducklake_meta.ducklake_delete_file ORDER BY begin_snapshot
----
1	2	NULL	27	4

# Verify new deletion file schema - should have _ducklake_internal_snapshot_id column
# since it was created from flushing inlined deletions
query II
SELECT column_name, column_type FROM (DESCRIBE SELECT * FROM '${DATA_PATH}/test_deletion_from_inlined_multiple_snapshots/**/*-delete.parquet') ORDER BY column_name
----
_ducklake_internal_snapshot_id	BIGINT
file_path	VARCHAR
pos	BIGINT

# Verify new deletion file data
# Rows 0-7 have snapshot_ids 3 and 4 (from inlined deletions)
# Rows 11-29 have snapshot_id 2 (from original delete)
query II
SELECT pos, _ducklake_internal_snapshot_id FROM '${DATA_PATH}/test_deletion_from_inlined_multiple_snapshots/**/*-delete.parquet' ORDER BY pos
----
0	3
1	3
2	3
3	3
4	3
5	4
6	4
7	4
11	2
12	2
13	2
14	2
15	2
16	2
17	2
18	2
19	2
20	2
21	2
22	2
23	2
24	2
25	2
26	2
27	2
28	2
29	2
